{
  "bootstrap": {
    "betaInterval95": [
      0.9153823613431276,
      1.1369837029583028
    ],
    "clusterBy": "reader",
    "distractorLapseInterval95": [
      0.0,
      0.012577975625078681
    ],
    "draws": [
      {
        "beta": 1.0703338924796104,
        "distractor_lapse": 0.0,
        "weight": 0.005
      },
      {
        "beta": 0.9951977227178641,
        "distractor_lapse": 0.0,
        "weight": 0.005
      },
      {
        "beta": 0.9744212488763841,
        "distractor_lapse": 0.0,
        "weight": 0.005
      },
      {
        "beta": 0.9846132523582897,
        "distractor_lapse": 0.0,
        "weight": 0.005
      },
      {
        "beta": 1.0107396414298404,
        "distractor_lapse": 0.0,
        "weight": 0.005
      },
      {
        "beta": 0.9641058325235863,
        "distractor_lapse": 0.0,
        "weight": 0.005
      },
      {
        "beta": 1.0295857421373114,
        "distractor_lapse": 0.0,
        "weight": 0.005
      },
      {
        "beta": 1.1076273245081465,
        "distractor_lapse": 0.0,
        "weight": 0.005
      },
      {
        "beta": 1.05855631951185,
        "distractor_lapse": 0.0,
        "weight": 0.005
      },
      {
        "beta": 1.1086758717960747,
        "distractor_lapse": 0.0,
        "weight": 0.005
      },
      {
        "beta": 0.939478931096001,
        "distractor_lapse": 0.0,
        "weight": 0.005
      },
      {
        "beta": 0.9716808635975183,
        "distractor_lapse": 0.0,
        "weight": 0.005
      },
      {
        "beta": 1.0869414782307474,
        "distractor_lapse": 0.0,
        "weight": 0.005
      },
      {
        "beta": 1.113378194879144,
        "distractor_lapse": 0.0,
        "weight": 0.005
      },
      {
        "beta": 1.087311392319927,
        "distractor_lapse": 0.0,
        "weight": 0.005
      },
      {
        "beta": 1.0337208459533547,
        "distractor_lapse": 0.0,
        "weight": 0.005
      },
      {
        "beta": 0.9945610869560302,
        "distractor_lapse": 0.0,
        "weight": 0.005
      },
      {
        "beta": 0.9891429581367361,
        "distractor_lapse": 0.0,
        "weight": 0.005
      },
      {
        "beta": 1.0381192058664357,
        "distractor_lapse": 0.0,
        "weight": 0.005
      },
      {
        "beta": 1.0418629877991512,
        "distractor_lapse": 0.013049422609172988,
        "weight": 0.005
      },
      {
        "beta": 0.9808430943777041,
        "distractor_lapse": 0.0,
        "weight": 0.005
      },
      {
        "beta": 1.1161120502572244,
        "distractor_lapse": 0.0,
        "weight": 0.005
      },
      {
        "beta": 0.9584280307080236,
        "distractor_lapse": 0.0,
        "weight": 0.005
      },
      {
        "beta": 1.0699699971509589,
        "distractor_lapse": 0.0,
        "weight": 0.005
      },
      {
        "beta": 0.938187377193105,
        "distractor_lapse": 0.0,
        "weight": 0.005
      },
      {
        "beta": 1.0938946025444647,
        "distractor_lapse": 0.011120733948968979,
        "weight": 0.005
      },
      {
        "beta": 0.9957160002669816,
        "distractor_lapse": 0.0,
        "weight": 0.005
      },
      {
        "beta": 0.9689561860498555,
        "distractor_lapse": 0.0,
        "weight": 0.005
      },
      {
        "beta": 0.9871021401577194,
        "distractor_lapse": 0.0,
        "weight": 0.005
      },
      {
        "beta": 1.0715516000750926,
        "distractor_lapse": 0.0,
        "weight": 0.005
      },
      {
        "beta": 1.0592072252574003,
        "distractor_lapse": 0.0,
        "weight": 0.005
      },
      {
        "beta": 1.0303752575042324,
        "distractor_lapse": 0.0,
        "weight": 0.005
      },
      {
        "beta": 0.9421980036396382,
        "distractor_lapse": 0.0,
        "weight": 0.005
      },
      {
        "beta": 0.9525348374813076,
        "distractor_lapse": 0.0,
        "weight": 0.005
      },
      {
        "beta": 1.0144794892072568,
        "distractor_lapse": 0.0,
        "weight": 0.005
      },
      {
        "beta": 1.0897943169587738,
        "distractor_lapse": 0.0,
        "weight": 0.005
      },
      {
        "beta": 1.0199517969498932,
        "distractor_lapse": 0.0,
        "weight": 0.005
      },
      {
        "beta": 1.094511918935352,
        "distractor_lapse": 0.0,
        "weight": 0.005
      },
      {
        "beta": 1.033684770771278,
        "distractor_lapse": 0.0,
        "weight": 0.005
      },
      {
        "beta": 0.9491348345786675,
        "distractor_lapse": 0.0,
        "weight": 0.005
      },
      {
        "beta": 0.9235713359363771,
        "distractor_lapse": 0.0,
        "weight": 0.005
      },
      {
        "beta": 1.1945942284733333,
        "distractor_lapse": 0.018631450805286682,
        "weight": 0.005
      },
      {
        "beta": 0.9607003031307838,
        "distractor_lapse": 0.0,
        "weight": 0.005
      },
      {
        "beta": 1.0982686594886946,
        "distractor_lapse": 0.0,
        "weight": 0.005
      },
      {
        "beta": 1.1133961900377647,
        "distractor_lapse": 0.0,
        "weight": 0.005
      },
      {
        "beta": 0.9154667422237441,
        "distractor_lapse": 0.0,
        "weight": 0.005
      },
      {
        "beta": 0.9485573384512311,
        "distractor_lapse": 0.0,
        "weight": 0.005
      },
      {
        "beta": 0.9651988936076898,
        "distractor_lapse": 0.0,
        "weight": 0.005
      },
      {
        "beta": 1.1110257195148439,
        "distractor_lapse": 0.0,
        "weight": 0.005
      },
      {
        "beta": 1.0811562516931335,
        "distractor_lapse": 0.0,
        "weight": 0.005
      },
      {
        "beta": 1.123563170755132,
        "distractor_lapse": 0.010682514479426464,
        "weight": 0.005
      },
      {
        "beta": 0.9939519945977833,
        "distractor_lapse": 0.0,
        "weight": 0.005
      },
      {
        "beta": 0.9786875576504053,
        "distractor_lapse": 0.0,
        "weight": 0.005
      },
      {
        "beta": 0.9492880989257018,
        "distractor_lapse": 0.0,
        "weight": 0.005
      },
      {
        "beta": 0.9335310277563764,
        "distractor_lapse": 0.0,
        "weight": 0.005
      },
      {
        "beta": 1.0712798969674278,
        "distractor_lapse": 0.0,
        "weight": 0.005
      },
      {
        "beta": 1.0480426315061058,
        "distractor_lapse": 0.0,
        "weight": 0.005
      },
      {
        "beta": 1.0304331648239886,
        "distractor_lapse": 0.0,
        "weight": 0.005
      },
      {
        "beta": 0.9833519860200812,
        "distractor_lapse": 0.0,
        "weight": 0.005
      },
      {
        "beta": 1.0484555710216295,
        "distractor_lapse": 0.0,
        "weight": 0.005
      },
      {
        "beta": 0.9523691718911211,
        "distractor_lapse": 0.0,
        "weight": 0.005
      },
      {
        "beta": 1.0188116510580782,
        "distractor_lapse": 0.0,
        "weight": 0.005
      },
      {
        "beta": 1.0716089599108887,
        "distractor_lapse": 0.0,
        "weight": 0.005
      },
      {
        "beta": 0.9954754631472504,
        "distractor_lapse": 0.0,
        "weight": 0.005
      },
      {
        "beta": 0.8903806365491811,
        "distractor_lapse": 0.0,
        "weight": 0.005
      },
      {
        "beta": 0.9484307125899528,
        "distractor_lapse": 0.0,
        "weight": 0.005
      },
      {
        "beta": 1.0693032484253717,
        "distractor_lapse": 0.0,
        "weight": 0.005
      },
      {
        "beta": 0.974004856298418,
        "distractor_lapse": 0.0,
        "weight": 0.005
      },
      {
        "beta": 1.02839294457912,
        "distractor_lapse": 0.0,
        "weight": 0.005
      },
      {
        "beta": 1.0430687293937422,
        "distractor_lapse": 0.0,
        "weight": 0.005
      },
      {
        "beta": 1.0451281903711913,
        "distractor_lapse": 0.0,
        "weight": 0.005
      },
      {
        "beta": 1.0902161365368979,
        "distractor_lapse": 0.0,
        "weight": 0.005
      },
      {
        "beta": 1.0531692560963384,
        "distractor_lapse": 0.0,
        "weight": 0.005
      },
      {
        "beta": 1.0523243118352403,
        "distractor_lapse": 0.0,
        "weight": 0.005
      },
      {
        "beta": 0.9748235657729475,
        "distractor_lapse": 0.0,
        "weight": 0.005
      },
      {
        "beta": 1.1377516437609765,
        "distractor_lapse": 0.0038890668942908224,
        "weight": 0.005
      },
      {
        "beta": 1.0028756401370265,
        "distractor_lapse": 0.0,
        "weight": 0.005
      },
      {
        "beta": 0.9773705966358068,
        "distractor_lapse": 0.0,
        "weight": 0.005
      },
      {
        "beta": 1.0066981641389594,
        "distractor_lapse": 0.0,
        "weight": 0.005
      },
      {
        "beta": 0.9848195558570321,
        "distractor_lapse": 0.0,
        "weight": 0.005
      },
      {
        "beta": 1.0568813044194985,
        "distractor_lapse": 0.0,
        "weight": 0.005
      },
      {
        "beta": 0.9669310760727202,
        "distractor_lapse": 0.0,
        "weight": 0.005
      },
      {
        "beta": 0.977879726419584,
        "distractor_lapse": 0.0,
        "weight": 0.005
      },
      {
        "beta": 0.9240741713176437,
        "distractor_lapse": 0.0,
        "weight": 0.005
      },
      {
        "beta": 1.0362839780655329,
        "distractor_lapse": 0.0,
        "weight": 0.005
      },
      {
        "beta": 1.1092287168208124,
        "distractor_lapse": 0.0,
        "weight": 0.005
      },
      {
        "beta": 1.1273187747562687,
        "distractor_lapse": 0.0070083966469318675,
        "weight": 0.005
      },
      {
        "beta": 1.0208053221601896,
        "distractor_lapse": 0.0,
        "weight": 0.005
      },